{
  "$schema": "../../schemas/auth-flow.schema.json",
  "schemaVersion": "1.0",
  "key": "auth.flow.totp-management.rotate-recovery-codes",
  "name": "TOTP Recovery Code Rotation",
  "summary": "Executes authenticated recovery-code replacement through the stable authentication flow boundary while preserving the enrolled TOTP factor.",
  "version": 1,
  "maturity": "implemented",
  "requestContract": "TotpManagementFlowRequest",
  "resultContract": "AuthenticationFlowResult<List<string>>",
  "handlerKeys": ["auth.handler.totp-management.rotate-recovery-codes"],
  "transitionKeys": ["auth.transition.totp-management.rotate-recovery-codes-success"],
  "entryActionKeys": ["auth.action.totp-management.rotate-recovery-codes"],
  "supportedAudiences": ["platform-user", "tenant-user", "customer-end-user"],
  "notes": [
    "The existing POST /api/auth/mfarecovery/rotate public contract is preserved while the server path is normalized through IAuthenticationFlowService.",
    "The typed handler requires an actually enrolled and enabled TOTP factor before the recovery-code set can be replaced."
  ],
  "sourceReferences": [
    { "sourceType": "code", "reference": "LagoVista/UserAdmin:src/LagoVista.UserAdmin/Authentication/AuthenticationFlowService.cs", "note": "RotateTotpRecoveryCodesAsync is the application front door." },
    { "sourceType": "code", "reference": "LagoVista/UserAdmin:src/LagoVista.UserAdmin/Authentication/Flows/TotpRecoveryCodeRotationFlowHandler.cs", "note": "Typed handler enforces the canonical precondition and delegates to AppUserMfaManager." },
    { "sourceType": "code", "reference": "LagoVista/UserAdminRest:src/LagoVista.UserAdmin.Rest/Rest/MfaController.cs", "note": "POST /api/auth/mfarecovery/rotate delegates to IAuthenticationFlowService." }
  ]
}
