{
  "$schema": "../../schemas/auth-flow.schema.json",
  "schemaVersion": "1.0",
  "key": "auth.flow.password-sign-in",
  "name": "Password Sign-In",
  "summary": "Executes anonymous password authentication through the stable application flow boundary and emits canonical Success, MFA Required, Rejected, or Locked Out outcomes.",
  "version": 1,
  "maturity": "implemented",
  "requestContract": "AuthLoginRequest",
  "resultContract": "AuthenticationFlowResult<AuthenticationResponse>",
  "handlerKeys": ["auth.handler.password-sign-in"],
  "transitionKeys": [
    "auth.transition.password-sign-in.success",
    "auth.transition.password-sign-in.mfa-required",
    "auth.transition.password-sign-in.rejected",
    "auth.transition.password-sign-in.locked-out"
  ],
  "entryActionKeys": ["auth.action.password-sign-in.submit"],
  "supportedAudiences": ["platform-user", "tenant-user", "customer-end-user"],
  "notes": [
    "The generated client and REST route remain stable; canonical transition selection is internal to the application flow.",
    "A valid password for an MFA-enabled account returns AuthenticationResponseState.MfaRequired without issuing the authenticated application session.",
    "Invalid password and unknown account converge on Rejected publicly while retaining distinct authentication-log evidence.",
    "Failures outside the four modeled outcomes are not silently reclassified by the flow handler."
  ],
  "sourceReferences": [
    { "sourceType": "code", "reference": "LagoVista/UserAdmin:src/LagoVista.UserAdmin/Authentication/AuthenticationFlowService.cs", "note": "AuthenticationFlowService.LoginWithPasswordAsync is the stable application front door and validates the emitted transition." },
    { "sourceType": "code", "reference": "LagoVista/UserAdmin:src/LagoVista.UserAdmin/Authentication/Flows/PasswordLoginFlowHandler.cs", "note": "Handler classifies manager results into the four canonical transitions." },
    { "sourceType": "code", "reference": "LagoVista/UserAdminRest:src/LagoVista.UserAdmin.Rest/Rest/AuthenticationFlowController.cs", "note": "POST /api/auth/password/login enters through IAuthenticationFlowService." }
  ]
}
